{
  "task_id": "jacobian/putnam-2adic-induction-audit",
  "conclusion": "UNIVERSAL_VALUATION_CERTIFIED",
  "result": {
    "base": {
      "b": [0, 1, 4],
      "u": [0, 2, 8],
      "P": [1, 1, 5],
      "valuations": {"u2": 3, "P2_minus_1": 2, "P2_plus_1": 1}
    },
    "difference_identity": {"left": "f(a)-f(b)", "right_factors": ["a-b", "a+b+1"]},
    "doubling_identities": {
      "taylor": "u_2n-2*u_n=u_n*(P_n-1)+u_n^2*K",
      "product": "P_2n=P_n*(P_n+2*u_n*Delta)"
    },
    "valuation_induction": {
      "hypotheses": [[1, 2], [1, 1], [0, 1]],
      "sub_one_term_lower_bounds": [[1, 2], [1, 3]],
      "add_one_reason": "P_2n_minus_1_divisible_by_8_implies_P_2n_plus_1_has_v2_1",
      "u_term_lower_bounds": [[1, 3], [2, 4]],
      "successor": [[1, 3], [1, 2], [0, 1]]
    },
    "target_transfer": {
      "u_difference_term_lower_bounds": [[2, 3], [2, 4]],
      "u_difference": [2, 3],
      "scale_v2": 1,
      "b_difference": [2, 2],
      "divides_exponent": [2, 2],
      "not_divides_exponent": [2, 3]
    },
    "finite_testing_role": "SANITY_ONLY_NOT_UNIVERSAL_PROOF"
  },
  "claimed_assurance": "COMPUTED",
  "scope": "the frozen recurrence and symbolic induction for every integer k>=1",
  "completeness": "COMPLETE",
  "evidence": [{"path": "evidence/answer.txt", "sha256": "sha256:e6620bf26f28673fa65e2c906d22ef7a9dcac4b11664fb7671196d7725cba620"}],
  "limitations": ["The checker validates the recurrence-difference identity and affine valuation arithmetic conditional on frozen doubling identities, but does not derive those identities or replay the Lean kernel proof."]
}
